[
  {"id":"rule:advantage","entity_type":"rule","name":"Advantage and Disadvantage","source":{"system":"dnd-5e","rules_version":"2024","content_type":"srd-sample"},"tags":["rules:2024","roll:d20","sheet:reference"],"rules_text":"Roll two d20s and use the higher result for Advantage or the lower result for Disadvantage. They do not stack."},
  {"id":"condition:poisoned","entity_type":"condition","name":"Poisoned","source":{"system":"dnd-5e","rules_version":"2024","content_type":"srd-sample"},"tags":["condition:poisoned","roll:disadvantage","sheet:conditions"],"rules_text":"A Poisoned creature has Disadvantage on attack rolls and ability checks."},
  {"id":"spell:magic-missile","entity_type":"spell","name":"Magic Missile","source":{"system":"dnd-5e","rules_version":"2024","content_type":"srd-sample"},"tags":["action:action","damage:force","target:creature","sheet:spells","automation:rollable"],"rules_text":"Create three darts of magical force. Each dart hits a creature you can see within range and deals force damage."},
  {"id":"spell:light","entity_type":"spell","name":"Light","source":{"system":"dnd-5e","rules_version":"2024","content_type":"srd-sample"},"tags":["action:action","duration:hour","target:object","sheet:spells"],"rules_text":"Touch one Large or smaller object. It sheds bright and dim light for the duration."},
  {"id":"item:longsword","entity_type":"item","name":"Longsword","source":{"system":"dnd-5e","rules_version":"2024","content_type":"srd-sample"},"tags":["damage:slashing","weapon:martial","property:versatile","sheet:inventory","sheet:actions"],"rules_text":"Martial melee weapon. Deals slashing damage and has the Versatile property."},
  {"id":"item:shield","entity_type":"item","name":"Shield","source":{"system":"dnd-5e","rules_version":"2024","content_type":"srd-sample"},"tags":["armor:shield","modifier:ac","sheet:inventory"],"rules_text":"While equipped, a shield grants a bonus to Armor Class."},
  {"id":"feature:arcane-recovery","entity_type":"feature","name":"Arcane Recovery","source":{"system":"dnd-5e","rules_version":"2024","content_type":"srd-sample"},"tags":["action:short-rest","resource:spell-slot","sheet:features"],"rules_text":"Recover expended spell slots after finishing a Short Rest, subject to the feature's level-based limit."},
  {"id":"rule:concentration","entity_type":"rule","name":"Concentration","source":{"system":"dnd-5e","rules_version":"2024","content_type":"srd-sample"},"tags":["rules:2024","duration:concentration","sheet:reference"],"rules_text":"You can concentrate on only one effect at a time. Damage may require a Constitution saving throw to maintain it."}
]
